{
  "$schema": "https://json-schema.org/draft/2020-12/schema",
  "$id": "https://www.cardano.build/data/index.schema.json",
  "title": "cardano.build index",
  "description": "The structured index behind https://www.cardano.build. Sections contain groups; groups contain items. Every page, llms.txt and llms-full.txt is generated from this file by scripts/build.mjs.",
  "type": "object",
  "required": ["name", "description", "version", "updated", "license", "endpoints", "contribute", "sections"],
  "properties": {
    "$schema": { "type": "string" },
    "name": { "type": "string" },
    "title": { "type": "string" },
    "description": { "type": "string" },
    "version": { "type": "string" },
    "updated": { "type": "string", "format": "date", "description": "Bump when you change the content." },
    "license": { "const": "CC0-1.0" },
    "homepage": { "type": "string", "format": "uri" },
    "repository": { "type": "string", "format": "uri" },
    "contribute": {
      "type": "object",
      "properties": {
        "pull_request": { "type": "string", "format": "uri" },
        "suggest": { "type": "string", "format": "uri" },
        "scope": { "type": "string" }
      }
    },
    "endpoints": {
      "type": "object",
      "additionalProperties": { "type": "string", "format": "uri" }
    },
    "stats": {
      "type": "object",
      "description": "Written by the build. Do not edit by hand.",
      "properties": {
        "sections": { "type": "integer" },
        "resources": { "type": "integer" },
        "links": { "type": "integer" }
      }
    },
    "sections": { "type": "array", "minItems": 1, "items": { "$ref": "#/$defs/section" } }
  },
  "$defs": {
    "id": { "type": "string", "pattern": "^[a-z0-9][a-z0-9-]*$" },
    "section": {
      "type": "object",
      "required": ["id", "title", "summary", "groups"],
      "properties": {
        "id": { "$ref": "#/$defs/id", "description": "Anchor on the page: https://www.cardano.build/#<id>" },
        "path": { "type": "string" },
        "title": { "type": "string" },
        "summary": { "type": "string" },
        "aliases": { "type": "array", "items": { "type": "string" }, "description": "Old anchors that should land on this section." },
        "groups": { "type": "array", "minItems": 1, "items": { "$ref": "#/$defs/group" } }
      },
      "additionalProperties": false
    },
    "group": {
      "type": "object",
      "required": ["items"],
      "properties": {
        "id": { "$ref": "#/$defs/id" },
        "title": { "type": "string" },
        "aliases": { "type": "array", "items": { "type": "string" } },
        "items": { "type": "array", "minItems": 1, "items": { "$ref": "#/$defs/item" } }
      },
      "additionalProperties": false
    },
    "item": {
      "type": "object",
      "required": ["name", "url"],
      "properties": {
        "id": { "$ref": "#/$defs/id", "description": "Optional anchor, e.g. #aiken." },
        "name": { "type": "string" },
        "url": { "type": "string", "format": "uri", "pattern": "^https?://" },
        "desc": { "type": "string" },
        "tags": { "type": "array", "items": { "type": "string" } },
        "links": {
          "type": "array",
          "items": {
            "type": "object",
            "required": ["label", "url"],
            "properties": {
              "label": { "type": "string" },
              "url": { "type": "string", "format": "uri", "pattern": "^https?://" }
            },
            "additionalProperties": false
          }
        }
      },
      "additionalProperties": false
    }
  }
}
