{
  "$schema": "https://www.cardano.build/data/index.schema.json",
  "name": "cardano.build",
  "title": "Cardano.Build — the Cardano builder index",
  "description": "An open, community-curated index of tools, SDKs, languages, infrastructure, people and learning resources for building on Cardano.",
  "version": "2.0.0",
  "updated": "2026-10-09",
  "license": "CC0-1.0",
  "homepage": "https://www.cardano.build",
  "repository": "https://github.com/selfdriven-octo/cardano-build",
  "contribute": {
    "pull_request": "https://github.com/selfdriven-octo/cardano-build/blob/main/docs/data/index.json",
    "suggest": "https://x.com/@selfdrivenF",
    "scope": "Anything that directly relates to building on Cardano — not investment, price or trading."
  },
  "endpoints": {
    "html": "https://www.cardano.build/",
    "llms": "https://www.cardano.build/llms.txt",
    "llms_full": "https://www.cardano.build/llms-full.txt",
    "index": "https://www.cardano.build/data/index.json",
    "schema": "https://www.cardano.build/data/index.schema.json",
    "agent_card": "https://www.cardano.build/.well-known/agent.json",
    "skill": "https://www.cardano.build/SKILL.md",
    "classic": "https://www.cardano.build/classic.html"
  },
  "stats": {
    "sections": 26,
    "resources": 477,
    "links": 551
  },
  "sections": [
    {
      "id": "start",
      "path": "start",
      "title": "Where do I start?",
      "summary": "First steps, guides and orientation for new Cardano builders.",
      "aliases": [
        "new-to-cardano",
        "new-to-cardano-collapse"
      ],
      "groups": [
        {
          "items": [
            {
              "name": "Ultimate Cardano Smart Contracts Book",
              "url": "https://a.co/d/04QyMZb2"
            },
            {
              "name": "Cardano fundamentals",
              "url": "https://www.youtube.com/watch?v=PdjoBLGLnlw",
              "desc": "ReddSpark"
            },
            {
              "name": "UTxOs, hashes etc. explained",
              "url": "https://www.youtube.com/watch?v=xARVAXoloY4&t=6",
              "desc": "Woodland Pools"
            },
            {
              "name": "Native tokens (NFTs & FTs)",
              "url": "https://www.youtube.com/watch?v=6oYio9hNxiM",
              "desc": "NerdOut — Andrew Westberg"
            },
            {
              "name": "Submitting transactions with cardano-cli",
              "url": "https://www.youtube.com/watch?v=Zs2AWS4xIr0"
            },
            {
              "name": "MeshJS",
              "url": "https://meshjs.dev/",
              "desc": "For experienced React / Next.js developers"
            },
            {
              "name": "OpShin example",
              "url": "https://github.com/OpShin/opshin-example",
              "desc": "For experienced Python developers"
            },
            {
              "name": "Zero to mainnet in 5 minutes with Helios",
              "url": "https://youtu.be/z5_1WiVc3aA",
              "desc": "Cardano smart contract walkthrough (CryptoJoe101)"
            },
            {
              "name": "History of Cardano",
              "url": "https://ctimelines.io",
              "desc": "ctimelines.io"
            },
            {
              "name": "Wisdom.Courses",
              "url": "https://wisdom.courses"
            },
            {
              "name": "Developer ecosystem surveys",
              "url": "https://github.com/cardano-foundation/state-of-the-developer-ecosystem/tree/main",
              "desc": "Cardano Foundation — state of the developer ecosystem"
            }
          ],
          "id": "first-steps"
        },
        {
          "title": "Guides",
          "items": [
            {
              "name": "Getting Started By Mesh",
              "url": "https://meshjs.dev/guides"
            },
            {
              "name": "Cookbook By PGWAD",
              "url": "https://armada-alliance.gitbook.io/cardano-blockchain-developer-cookbook/"
            }
          ],
          "id": "guides"
        }
      ]
    },
    {
      "id": "quickstarts",
      "path": "quickstarts",
      "title": "Hello-world quick starts",
      "summary": "The shortest path from zero to a working transaction or validator, per language.",
      "aliases": [
        "hello-world",
        "hello-worlds",
        "hello-world-collapse"
      ],
      "groups": [
        {
          "items": [
            {
              "name": "PyCardano",
              "url": "https://github.com/Python-Cardano/pycardano/blob/main/examples/plutus/forty_two/forty_two.py",
              "desc": "Submit transactions — Python"
            },
            {
              "name": "Pebble",
              "url": "https://pluts.harmoniclabs.tech/",
              "desc": "On-chain scripts — TypeScript (formerly plu-ts)"
            },
            {
              "name": "Aiken",
              "url": "https://aiken-lang.org/example--hello-world",
              "desc": "On-chain scripts — Aiken"
            },
            {
              "name": "Helios",
              "url": "https://helios-lang.io/docs/learn/intro",
              "desc": "On-chain scripts — Helios"
            },
            {
              "name": "OpShin",
              "url": "https://github.com/OpShin/opshin-starter-kit",
              "desc": "On-chain scripts — Python"
            },
            {
              "name": "Plinth",
              "url": "https://plutus.cardano.intersectmbo.org/docs/",
              "desc": "On-chain scripts — Haskell (formerly Plutus Tx)"
            },
            {
              "name": "Demeter",
              "url": "https://demeter.run/starter-kits",
              "desc": "Hosted Cardano infrastructure with starter kits"
            }
          ]
        }
      ]
    },
    {
      "id": "tools",
      "path": "tools",
      "title": "Tools, SDKs & languages",
      "summary": "Smart contract languages, off-chain SDKs, APIs and hosted infrastructure.",
      "aliases": [
        "dev-tools",
        "home",
        "plu-ts"
      ],
      "groups": [
        {
          "id": "start-here",
          "title": "Start here",
          "items": [
            {
              "name": "Cardano Developer Portal",
              "url": "https://developers.cardano.org/docs/get-started",
              "desc": "Cardano Getting Started for Developers",
              "links": [
                {
                  "label": "Charles Whiteboard Video",
                  "url": "https://www.youtube.com/watch?v=Ja9D0kpksxw"
                },
                {
                  "label": "Charles Roadmap Video (2024)",
                  "url": "https://www.youtube.com/watch?v=_s4OauGIzNg"
                },
                {
                  "label": "Why Cardano (The Motivation)",
                  "url": "https://why.cardano.org/en/introduction/motivation/"
                },
                {
                  "label": "Cardano Forum (Developers)",
                  "url": "https://forum.cardano.org/c/developers/29"
                },
                {
                  "label": "Cardano CLI Reference",
                  "url": "https://github.com/input-output-hk/cardano-node/blob/master/doc/reference/cardano-node-cli-reference.md/"
                },
                {
                  "label": "Smart Contracts Book",
                  "url": "https://a.co/d/04QyMZb2"
                },
                {
                  "label": "Plutus v3 Upgrade Blog Post",
                  "url": "https://iohk.io/en/blog/posts/2024/02/12/unlocking-more-opportunities-with-plutus-v3//"
                }
              ],
              "id": "getting-started"
            },
            {
              "name": "ABLE Pool cheat sheets",
              "url": "https://able-pool.io/document/",
              "desc": "cardano-cli, SanchoNet & Voltaire (CIP-1694)"
            }
          ]
        },
        {
          "id": "on-chain",
          "title": "On-chain languages & toolchains",
          "items": [
            {
              "name": "Aiken",
              "url": "https://aiken-lang.org",
              "desc": "Programming language & toolchain for developing smart contracts",
              "links": [
                {
                  "label": "Howard Aiken",
                  "url": "https://en.wikipedia.org/wiki/Howard_H._Aiken"
                },
                {
                  "label": "Awesome List Code Sharing",
                  "url": "https://github.com/aiken-lang/awesome-aiken/tree/main"
                },
                {
                  "label": "Aiken Hello World",
                  "url": "https://aiken-lang.org/example--hello-world"
                },
                {
                  "label": "Aiken Step by Step Course (Youtube)",
                  "url": "https://www.youtube.com/watch?v=N-JmswJuQRU"
                },
                {
                  "label": "Davy Jones' Locker",
                  "url": "https://github.com/ariady-putra/morbid/"
                },
                {
                  "label": "Scarmuega; Hello World using Cardano-cli",
                  "url": "https://github.com/scarmuega/aiken-cli-hello-world"
                },
                {
                  "label": "Mint Script with On-Chain Record of Mints",
                  "url": "https://github.com/keyan-m/cardano-recorded-mint"
                },
                {
                  "label": "ADAPulse; Overiew",
                  "url": "https://www.youtube.com/watch?v=SpNX3Hun7fM"
                },
                {
                  "label": "ReddSpark; Beginners Guide",
                  "url": "https://www.youtube.com/watch?v=-H5llvQdpRw"
                },
                {
                  "label": "Learn Cardano",
                  "url": "https://www.youtube.com/watch?v=JWmvVJz_X1M"
                },
                {